{"$schema":"https://json-schema.org/draft/2020-12/schema","$id":"https://master-all-strings.dev/schema/performance/performance-alignment-v1.schema.json","title":"PerformanceAlignmentResultV1","type":"object","additionalProperties":false,"required":["schema_version","assignment_id","content_id","performance_session_id","alignment_policy","aligned_events","unmatched_expected_ids","unmatched_observed_ids"],"properties":{"schema_version":{"const":"1.0.0"},"assignment_id":{"type":"string","minLength":1},"content_id":{"type":"string","minLength":1},"performance_session_id":{"type":"string","minLength":1},"alignment_policy":{"type":"object"},"aligned_events":{"type":"array"},"unmatched_expected_ids":{"type":"array","items":{"type":"string"},"uniqueItems":true},"unmatched_observed_ids":{"type":"array","items":{"type":"string"},"uniqueItems":true}}}
